No.     Time           Source                Destination           Protocol Length Info
   1539 28.548819      192.168.0.110         128.119.245.12        HTTP     485    GET /wireshark-labs/INTRO-wireshark-file1.html HTTP/1.1 

Frame 1539: 485 bytes on wire (3880 bits), 485 bytes captured (3880 bits) on interface 0
Ethernet II, Src: IntelCor_a9:c1:a8 (48:45:20:a9:c1:a8), Dst: Tp-LinkT_05:32:9a (c4:71:54:05:32:9a)
Internet Protocol Version 4, Src: 192.168.0.110, Dst: 128.119.245.12
Transmission Control Protocol, Src Port: 59106, Dst Port: 80, Seq: 1, Ack: 1, Len: 431
Hypertext Transfer Protocol

No.     Time           Source                Destination           Protocol Length Info
   1545 28.578643      128.119.245.12        192.168.0.110         HTTP     492    HTTP/1.1 200 OK  (text/html)

Frame 1545: 492 bytes on wire (3936 bits), 492 bytes captured (3936 bits) on interface 0
Ethernet II, Src: Tp-LinkT_05:32:9a (c4:71:54:05:32:9a), Dst: IntelCor_a9:c1:a8 (48:45:20:a9:c1:a8)
Internet Protocol Version 4, Src: 128.119.245.12, Dst: 192.168.0.110
Transmission Control Protocol, Src Port: 80, Dst Port: 59106, Seq: 1, Ack: 432, Len: 438
Hypertext Transfer Protocol
Line-based text data: text/html (3 lines)

No.     Time           Source                Destination           Protocol Length Info
   1591 28.708838      192.168.0.110         128.119.245.12        HTTP     328    GET /favicon.ico HTTP/1.1 

Frame 1591: 328 bytes on wire (2624 bits), 328 bytes captured (2624 bits) on interface 0
Ethernet II, Src: IntelCor_a9:c1:a8 (48:45:20:a9:c1:a8), Dst: Tp-LinkT_05:32:9a (c4:71:54:05:32:9a)
Internet Protocol Version 4, Src: 192.168.0.110, Dst: 128.119.245.12
Transmission Control Protocol, Src Port: 59109, Dst Port: 80, Seq: 1, Ack: 1, Len: 274
Hypertext Transfer Protocol

No.     Time           Source                Destination           Protocol Length Info
   1595 28.737516      128.119.245.12        192.168.0.110         HTTP     539    HTTP/1.1 404 Not Found  (text/html)

Frame 1595: 539 bytes on wire (4312 bits), 539 bytes captured (4312 bits) on interface 0
Ethernet II, Src: Tp-LinkT_05:32:9a (c4:71:54:05:32:9a), Dst: IntelCor_a9:c1:a8 (48:45:20:a9:c1:a8)
Internet Protocol Version 4, Src: 128.119.245.12, Dst: 192.168.0.110
Transmission Control Protocol, Src Port: 80, Dst Port: 59109, Seq: 1, Ack: 275, Len: 485
Hypertext Transfer Protocol
Line-based text data: text/html (7 lines)
